{
  "calculator": "promoter",
  "current_request": {
    "calibration": "in_vitro",
    "id": "current",
    "output": {
      "elements": true,
      "legacy_keys": false,
      "states": "selected"
    },
    "projection": {
      "contig": "synthetic-contig",
      "contig_length": 1000,
      "origin": 980,
      "origin_crossing": true,
      "sequence_strand": "+",
      "topology": "circular"
    },
    "scan": {
      "mode": "positions",
      "positions": [
        {
          "strand": "+",
          "tss": 100
        },
        {
          "strand": "-",
          "tss": 100
        }
      ]
    },
    "sequence": "ACGTACGTACGTACGTACGTACGTACGTACGTACGTACGTACGTACGTACGTACGTACGTACGTACGTACGTACGTACGTACGTACGTACGTACGTACGTACGTACGTACGTACGTACGTACGTACGTACGTACGTACGTACGTACGTACGTACGTACGTACGTACGTACGTACGTACGTACGTACGTACGTACGTACGT"
  },
  "pair": {
    "current": {
      "id": "current",
      "sequence": "ACGTACGTACGTACGTACGTACGTACGTACGTACGTACGTACGTACGTACGTACGTACGTACGTACGTACGTACGTACGTACGTACGTACGTACGTACGTACGTACGTACGTACGTACGTACGTACGTACGTACGTACGTACGTACGTACGTACGTACGTACGTACGTACGTACGTACGTACGTACGTACGTACGTACGT"
    },
    "edits": [
      {
        "end": 80,
        "id": "edit",
        "replacement": "GG",
        "start": 80
      }
    ],
    "pair_id": "paired-promoter-indel",
    "recoded": {
      "id": "recoded",
      "sequence": "ACGTACGTACGTACGTACGTACGTACGTACGTACGTACGTACGTACGTACGTACGTACGTACGTACGTACGTACGTACGTGGACGTACGTACGTACGTACGTACGTACGTACGTACGTACGTACGTACGTACGTACGTACGTACGTACGTACGTACGTACGTACGTACGTACGTACGTACGTACGTACGTACGTACGTACGT"
    },
    "schema_version": "paired-edit-input-1",
    "topology": "linear"
  },
  "recoded_request": {
    "calibration": "in_vitro",
    "id": "recoded",
    "output": {
      "elements": true,
      "legacy_keys": false,
      "states": "selected"
    },
    "projection": {
      "contig": "synthetic-contig",
      "contig_length": 1000,
      "origin": 980,
      "origin_crossing": true,
      "sequence_strand": "+",
      "topology": "circular"
    },
    "scan": {
      "mode": "positions",
      "positions": [
        {
          "strand": "+",
          "tss": 102
        },
        {
          "strand": "-",
          "tss": 102
        }
      ]
    },
    "sequence": "ACGTACGTACGTACGTACGTACGTACGTACGTACGTACGTACGTACGTACGTACGTACGTACGTACGTACGTACGTACGTGGACGTACGTACGTACGTACGTACGTACGTACGTACGTACGTACGTACGTACGTACGTACGTACGTACGTACGTACGTACGTACGTACGTACGTACGTACGTACGTACGTACGTACGTACGT"
  },
  "schema_version": "paired-regulatory-request-1",
  "settings": {
    "seconds_per_side": 30.0
  }
}
